{
  "$schema": "docs/validation/compatibility-evidence.schema.json",
  "schema": "xr-foundry.compatibility_evidence.v1",
  "kind": "editor_automated",
  "profile_id": "unity-6000.3-inventory-authoring-windows-editor",
  "commit_sha": "a25bbc7c9855ae4f094a58e43d8ab5ffdf37a7bf",
  "target": {
    "engine": {
      "id": "unity",
      "version": "6000.3.19f1"
    },
    "editor": {
      "id": "unity-editor",
      "version": "6000.3.19f1"
    },
    "renderer": {
      "id": "not_applicable",
      "version": "not_applicable"
    },
    "requested_dependencies": {
      "com.unity.test-framework": "1.6.0"
    },
    "resolved_dependencies": {
      "com.unity.ext.nunit": "2.0.5",
      "com.unity.modules.imgui": "1.0.0",
      "com.unity.modules.jsonserialize": "1.0.0",
      "com.unity.test-framework": "1.6.0"
    },
    "build_target": "WindowsEditor",
    "graphics_api": "Null",
    "scripting_backend": "Mono",
    "architecture": "x86_64",
    "xr_provider": {
      "id": "not_applicable",
      "version": "not_applicable"
    },
    "runtime": {
      "id": "not_applicable",
      "version": "not_applicable"
    },
    "input_routes": [
      "not_applicable"
    ],
    "device": {
      "id": "windows-editor-host",
      "version": "10.0.26200"
    }
  },
  "package_versions": {
    "com.lingkyn.inventory.core": "0.1.1",
    "com.lingkyn.inventory.unity": "0.1.1"
  },
  "resolved_dependencies": {
    "com.unity.ext.nunit": "2.0.5",
    "com.unity.modules.imgui": "1.0.0",
    "com.unity.modules.jsonserialize": "1.0.0",
    "com.unity.test-framework": "1.6.0"
  },
  "manifest": {
    "path": "docs/validation/evidence/unity-6000.3-inventory-authoring-windows-editor/consumer-manifest.json",
    "sha256": "890cf96dac387ceb79ae8191bdd0dd517354361f3c3801a095b35d3a1c6914cc"
  },
  "lock": {
    "path": "docs/validation/evidence/unity-6000.3-inventory-authoring-windows-editor/consumer-packages-lock.json",
    "sha256": "4e230a4c4a00809cedacfe836a8d25c0ca0c558da4142cfeb5963fd92b648acb"
  },
  "checks": [
    {
      "id": "editor_compile",
      "status": "pass",
      "evidence_refs": [
        {
          "kind": "compile_result",
          "ref": "docs/validation/evidence/unity-6000.3-inventory-authoring-windows-editor/compile-result.json",
          "sha256": "a44968c699474aaa43bff681d0da213d9daace11c0a2c4aa3e6fba20dbd40636"
        }
      ]
    },
    {
      "id": "editmode_tests",
      "status": "pass",
      "evidence_refs": [
        {
          "kind": "nunit_result",
          "ref": "docs/validation/evidence/unity-6000.3-inventory-authoring-windows-editor/editmode-results.xml",
          "sha256": "fba9a08eace25beee29f315ea534fb83f7b55a8fa5bcb990bbce35c44ef4ba1a"
        }
      ]
    }
  ]
}
