{
  "$schema": "docs/validation/compatibility-evidence.schema.json",
  "schema": "xr-foundry.compatibility_evidence.v1",
  "kind": "editor_automated",
  "profile_id": "unity-6000.3-xr-baseline-openxr-windows-editor",
  "commit_sha": "a25bbc7c9855ae4f094a58e43d8ab5ffdf37a7bf",
  "target": {
    "engine": {
      "id": "unity",
      "version": "6000.3.19f1"
    },
    "editor": {
      "id": "unity-editor",
      "version": "6000.3.19f1"
    },
    "renderer": {
      "id": "not_applicable",
      "version": "not_applicable"
    },
    "requested_dependencies": {
      "com.unity.inputsystem": "1.19.0",
      "com.unity.test-framework": "1.6.0",
      "com.unity.xr.interaction.toolkit": "3.5.1",
      "com.unity.xr.management": "4.5.3",
      "com.unity.xr.openxr": "1.16.0"
    },
    "resolved_dependencies": {
      "com.unity.ext.nunit": "2.0.5",
      "com.unity.inputsystem": "1.19.0",
      "com.unity.mathematics": "1.3.3",
      "com.unity.modules.audio": "1.0.0",
      "com.unity.modules.hierarchycore": "1.0.0",
      "com.unity.modules.imgui": "1.0.0",
      "com.unity.modules.jsonserialize": "1.0.0",
      "com.unity.modules.physics": "1.0.0",
      "com.unity.modules.subsystems": "1.0.0",
      "com.unity.modules.ui": "1.0.0",
      "com.unity.modules.uielements": "1.0.0",
      "com.unity.modules.vr": "1.0.0",
      "com.unity.modules.xr": "1.0.0",
      "com.unity.test-framework": "1.6.0",
      "com.unity.ugui": "2.0.0",
      "com.unity.xr.core-utils": "2.6.0",
      "com.unity.xr.interaction.toolkit": "3.5.1",
      "com.unity.xr.legacyinputhelpers": "2.1.13",
      "com.unity.xr.management": "4.5.3",
      "com.unity.xr.openxr": "1.16.0"
    },
    "build_target": "WindowsEditor",
    "graphics_api": "Null",
    "scripting_backend": "Mono",
    "architecture": "x86_64",
    "xr_provider": {
      "id": "com.unity.xr.openxr",
      "version": "1.16.0"
    },
    "runtime": {
      "id": "not_applicable",
      "version": "not_applicable"
    },
    "input_routes": [
      "xri-controller",
      "xri-ray"
    ],
    "device": {
      "id": "windows-editor-host",
      "version": "10.0.26200"
    }
  },
  "package_versions": {
    "com.lingkyn.xr-baseline": "0.1.0"
  },
  "resolved_dependencies": {
    "com.unity.ext.nunit": "2.0.5",
    "com.unity.inputsystem": "1.19.0",
    "com.unity.mathematics": "1.3.3",
    "com.unity.modules.audio": "1.0.0",
    "com.unity.modules.hierarchycore": "1.0.0",
    "com.unity.modules.imgui": "1.0.0",
    "com.unity.modules.jsonserialize": "1.0.0",
    "com.unity.modules.physics": "1.0.0",
    "com.unity.modules.subsystems": "1.0.0",
    "com.unity.modules.ui": "1.0.0",
    "com.unity.modules.uielements": "1.0.0",
    "com.unity.modules.vr": "1.0.0",
    "com.unity.modules.xr": "1.0.0",
    "com.unity.test-framework": "1.6.0",
    "com.unity.ugui": "2.0.0",
    "com.unity.xr.core-utils": "2.6.0",
    "com.unity.xr.interaction.toolkit": "3.5.1",
    "com.unity.xr.legacyinputhelpers": "2.1.13",
    "com.unity.xr.management": "4.5.3",
    "com.unity.xr.openxr": "1.16.0"
  },
  "manifest": {
    "path": "docs/validation/evidence/unity-6000.3-xr-baseline-openxr-windows-editor/consumer-manifest.json",
    "sha256": "b596bdf4d1289f5a4119690bfd004fcccacd7822fe3d6252533b3596bd3b15a0"
  },
  "lock": {
    "path": "docs/validation/evidence/unity-6000.3-xr-baseline-openxr-windows-editor/consumer-packages-lock.json",
    "sha256": "629f0017b90aea16b50d0f5f46fd8c8b0ec94d56ac1f98edebb39a5fe3740a6d"
  },
  "checks": [
    {
      "id": "editor_compile",
      "status": "pass",
      "evidence_refs": [
        {
          "kind": "compile_result",
          "ref": "docs/validation/evidence/unity-6000.3-xr-baseline-openxr-windows-editor/compile-result.json",
          "sha256": "1142a887e41080f057e545f6c7e6867a083e16902d804b1aa6813144b6fc209c"
        }
      ]
    },
    {
      "id": "editmode_tests",
      "status": "pass",
      "evidence_refs": [
        {
          "kind": "nunit_result",
          "ref": "docs/validation/evidence/unity-6000.3-xr-baseline-openxr-windows-editor/editmode-results.xml",
          "sha256": "932a1d672981e038c3387f977ff31e45da526f56203dff3b8ae7f000d87b9844"
        }
      ]
    }
  ]
}
