{
  "$schema": "docs/validation/compatibility-evidence.schema.json",
  "schema": "xr-foundry.compatibility_evidence.v1",
  "kind": "editor_automated",
  "profile_id": "unity-6000.3-inventory-xr-uitoolkit-openxr-windows-editor",
  "commit_sha": "a25bbc7c9855ae4f094a58e43d8ab5ffdf37a7bf",
  "target": {
    "engine": {
      "id": "unity",
      "version": "6000.3.19f1"
    },
    "editor": {
      "id": "unity-editor",
      "version": "6000.3.19f1"
    },
    "renderer": {
      "id": "com.unity.modules.uielements",
      "version": "1.0.0"
    },
    "requested_dependencies": {
      "com.unity.inputsystem": "1.19.0",
      "com.unity.test-framework": "1.6.0",
      "com.unity.xr.management": "4.5.3",
      "com.unity.xr.openxr": "1.16.0"
    },
    "resolved_dependencies": {
      "com.unity.ext.nunit": "2.0.5",
      "com.unity.inputsystem": "1.19.0",
      "com.unity.mathematics": "1.3.3",
      "com.unity.modules.audio": "1.0.0",
      "com.unity.modules.hierarchycore": "1.0.0",
      "com.unity.modules.imgui": "1.0.0",
      "com.unity.modules.jsonserialize": "1.0.0",
      "com.unity.modules.physics": "1.0.0",
      "com.unity.modules.subsystems": "1.0.0",
      "com.unity.modules.ui": "1.0.0",
      "com.unity.modules.uielements": "1.0.0",
      "com.unity.modules.vr": "1.0.0",
      "com.unity.modules.xr": "1.0.0",
      "com.unity.test-framework": "1.6.0",
      "com.unity.ugui": "2.0.0",
      "com.unity.xr.core-utils": "2.6.0",
      "com.unity.xr.interaction.toolkit": "3.5.1",
      "com.unity.xr.legacyinputhelpers": "2.1.13",
      "com.unity.xr.management": "4.5.3",
      "com.unity.xr.openxr": "1.16.0"
    },
    "build_target": "WindowsEditor",
    "graphics_api": "Null",
    "scripting_backend": "Mono",
    "architecture": "x86_64",
    "xr_provider": {
      "id": "com.unity.xr.openxr",
      "version": "1.16.0"
    },
    "runtime": {
      "id": "not_applicable",
      "version": "not_applicable"
    },
    "input_routes": [
      "xri-ray"
    ],
    "device": {
      "id": "windows-editor-host",
      "version": "10.0.26200"
    }
  },
  "package_versions": {
    "com.lingkyn.inventory.core": "0.1.1",
    "com.lingkyn.inventory.presentation": "0.1.0",
    "com.lingkyn.inventory.uitoolkit": "0.1.0",
    "com.lingkyn.inventory.xr.uitoolkit": "0.1.0"
  },
  "resolved_dependencies": {
    "com.unity.ext.nunit": "2.0.5",
    "com.unity.inputsystem": "1.19.0",
    "com.unity.mathematics": "1.3.3",
    "com.unity.modules.audio": "1.0.0",
    "com.unity.modules.hierarchycore": "1.0.0",
    "com.unity.modules.imgui": "1.0.0",
    "com.unity.modules.jsonserialize": "1.0.0",
    "com.unity.modules.physics": "1.0.0",
    "com.unity.modules.subsystems": "1.0.0",
    "com.unity.modules.ui": "1.0.0",
    "com.unity.modules.uielements": "1.0.0",
    "com.unity.modules.vr": "1.0.0",
    "com.unity.modules.xr": "1.0.0",
    "com.unity.test-framework": "1.6.0",
    "com.unity.ugui": "2.0.0",
    "com.unity.xr.core-utils": "2.6.0",
    "com.unity.xr.interaction.toolkit": "3.5.1",
    "com.unity.xr.legacyinputhelpers": "2.1.13",
    "com.unity.xr.management": "4.5.3",
    "com.unity.xr.openxr": "1.16.0"
  },
  "manifest": {
    "path": "docs/validation/evidence/unity-6000.3-inventory-xr-uitoolkit-openxr-windows-editor/consumer-manifest.json",
    "sha256": "c70f34137a9ef7c2233d765f53408668ef37c2392784a77b0f4f02dc901e3f4b"
  },
  "lock": {
    "path": "docs/validation/evidence/unity-6000.3-inventory-xr-uitoolkit-openxr-windows-editor/consumer-packages-lock.json",
    "sha256": "5aa43b2c9c63f2619a75c1ccc7b7f3e639ec3c74d650faa6d72780007543fb56"
  },
  "checks": [
    {
      "id": "editor_compile",
      "status": "pass",
      "evidence_refs": [
        {
          "kind": "compile_result",
          "ref": "docs/validation/evidence/unity-6000.3-inventory-xr-uitoolkit-openxr-windows-editor/compile-result.json",
          "sha256": "1c3cf0559e65d41feb8c3516f92810741f8d31e5aeec002b638cda2d5d126de2"
        }
      ]
    },
    {
      "id": "editmode_tests",
      "status": "pass",
      "evidence_refs": [
        {
          "kind": "nunit_result",
          "ref": "docs/validation/evidence/unity-6000.3-inventory-xr-uitoolkit-openxr-windows-editor/editmode-results.xml",
          "sha256": "392b4202ffc10359a93a85f06487bb5a83496fbaac816ff0cc36e9545472e2cf"
        }
      ]
    },
    {
      "id": "playmode_tests",
      "status": "pass",
      "evidence_refs": [
        {
          "kind": "nunit_result",
          "ref": "docs/validation/evidence/unity-6000.3-inventory-xr-uitoolkit-openxr-windows-editor/playmode-results.xml",
          "sha256": "f42082b683e0437a044b9d08e375950182e090b9b14cce17eeece75d683ecc3e"
        }
      ]
    }
  ]
}
