{
  "$schema": "docs/validation/compatibility-evidence.schema.json",
  "schema": "xr-foundry.compatibility_evidence.v1",
  "kind": "editor_automated",
  "profile_id": "unity-6000.3-persistence-unity-windows-editor",
  "commit_sha": "4a2f358000b9704700f8f90e1a15907938bb2ce4",
  "target": {
    "engine": {
      "id": "unity",
      "version": "6000.3.19f1"
    },
    "editor": {
      "id": "unity-editor",
      "version": "6000.3.19f1"
    },
    "renderer": {
      "id": "not_applicable",
      "version": "not_applicable"
    },
    "requested_dependencies": {
      "com.unity.test-framework": "1.6.0"
    },
    "resolved_dependencies": {
      "com.unity.ext.nunit": "2.0.5",
      "com.unity.modules.imgui": "1.0.0",
      "com.unity.modules.jsonserialize": "1.0.0",
      "com.unity.test-framework": "1.6.0"
    },
    "build_target": "WindowsEditor",
    "graphics_api": "Null",
    "scripting_backend": "Mono",
    "architecture": "x86_64",
    "xr_provider": {
      "id": "not_applicable",
      "version": "not_applicable"
    },
    "runtime": {
      "id": "not_applicable",
      "version": "not_applicable"
    },
    "input_routes": [
      "not_applicable"
    ],
    "device": {
      "id": "windows-editor-host",
      "version": "10.0.26200"
    }
  },
  "package_versions": {
    "com.lingkyn.persistence.core": "0.1.0",
    "com.lingkyn.persistence.unity": "0.1.0"
  },
  "resolved_dependencies": {
    "com.unity.ext.nunit": "2.0.5",
    "com.unity.modules.imgui": "1.0.0",
    "com.unity.modules.jsonserialize": "1.0.0",
    "com.unity.test-framework": "1.6.0"
  },
  "manifest": {
    "path": "docs/validation/evidence/unity-6000.3-persistence-unity-windows-editor/consumer-manifest.json",
    "sha256": "d01077d8c51d2c1967a22dccfa2e11c4d00413124444a8ab0b4eff40c19fe18c"
  },
  "lock": {
    "path": "docs/validation/evidence/unity-6000.3-persistence-unity-windows-editor/consumer-packages-lock.json",
    "sha256": "ee596b825189f87c183e6fa9477c30c255eda2084bd15df384a3f52bdd510e70"
  },
  "checks": [
    {
      "id": "editor_compile",
      "status": "pass",
      "evidence_refs": [
        {
          "kind": "compile_result",
          "ref": "docs/validation/evidence/unity-6000.3-persistence-unity-windows-editor/compile-result.json",
          "sha256": "0364580e31e205b90f828a4f1c3bae9b7eea3319455603e6cdb96f7c76ff5e28"
        }
      ]
    },
    {
      "id": "editmode_tests",
      "status": "pass",
      "evidence_refs": [
        {
          "kind": "nunit_result",
          "ref": "docs/validation/evidence/unity-6000.3-persistence-unity-windows-editor/editmode-results.xml",
          "sha256": "81c087d0c96cc13c96862e6d3cadaec50021951d24d102914007bdea48089c52"
        }
      ]
    }
  ]
}
